company_name,domain,fail_cites
SWIBER OFFSHORE CONSTRUCTION PTE LTD,www.swiber.com,
RESOLUTE OFFSHORE PTE LTD,,"directory.marinelink.com: Maritime Directory,www.swiber.com: Home :: Swiber Limited,www.sgpbusiness.com: Singapore Business Directory - Search Singapore Registered ...,www.infobel.com : International-Infobel-Phone directory,sg.finance.yahoo.com: Yahoo Finance - Business finance, stock market, quotes, news,vallianz.listedcompany.com: Vallianz Holdings Limited - Investor Relations: Profile,www.singaporecontacts.com: Contact us - Singapore Airlines,firmsg.com : Typent Pte. Ltd. | In Business | 200412677R | Company ... - FirmSG.com"
VALLIANZ OFFSHORE MARINE,www.vallianzholdings.com,
PT VALLIANZ OFFSHORE MARITIM,vallianz.co.id,
CHEONMASAN TUNNEL CORP,,"www.hoovers.com : Hoovers,www.dh2002.co.kr: 동해종합기술공사,www.naraco.kr: Nara Corporation,www.businesskorea.co.kr: 비즈니스코리아 - BusinessKorea,tunnelcorp.com.au: Tunnelcorp: Microtunnelling Specialists - Auger Boring - Laser Guided ...,www.nytimes.com: The New York Times - Breaking News, World News & Multimedia"
ABU DHABI PORTS COMPANY PJSC,www.adports.ae,
